{
  "schema_version": "1.0",
  "artifact_id": "research/aoi-kisaragi-fixture/partial-workspace",
  "created_by": {
    "component": "kokorox",
    "version": "0.0.0.dev0"
  },
  "request": {
    "path": "request.json",
    "sha256": "29e8bcae99fc0044d60eeccc9f016bc53870154a9509d33105d4d33d60e70e8c"
  },
  "sources": [
    {
      "path": "sources/source-official-profile.json",
      "sha256": "96512947de9c94d864c4164ed8be439446f75ecda999269368c2453c5b6ddb2c"
    }
  ],
  "claims": [
    {
      "path": "claims/claim-history.json",
      "sha256": "b431850aea46102e62799bd6c81941441d5f1ea544c3cb02232bf50d219cfb6e"
    },
    {
      "path": "claims/claim-role.json",
      "sha256": "c41bee442084a6579d7f595b749457abe60210a7dc27e393ab3e933a0d39bca0"
    }
  ],
  "conflicts": [
    {
      "path": "conflicts/conflict-adaptation-wording.json",
      "sha256": "04e4bbc80de2436f6902d15c1dc7435f313a77c3183b64f5f9fb9ba7132b17ae"
    }
  ],
  "coverage": {
    "path": "coverage.json",
    "sha256": "cc625c082f21533db1abf0b4e68e1f1cfb4e15c16f04138b74f7b034526f78bb"
  }
}
